[
  {
    "PaymentScheduleId": 1007210,
    "LoanId": 100721,
    "NextPaymentDueDate": "2026-06-01T00:00:00",
    "PaymentDueMonth": "2026-06-01T00:00:00",
    "TotalPaymentAmount": 1250.25,
    "PendingEscrowPaymentAmount": 360,
    "InterestRate": 0.051,
    "MonthlyPaymentAmount": 890.25,
    "MonthlyPaymentPrincipalAmount": 311.59,
    "MonthlyPaymentInterestAmount": 578.66,
    "MonthlyCountyTaxAmount": 216,
    "MonthlyHazardInsuranceAmount": 144,
    "QuotedLateChargeFeeAmount": 35,
    "LateChargeGraceEndDate": "2026-06-01T00:00:00"
  },
  {
    "PaymentScheduleId": 1007211,
    "LoanId": 100721,
    "NextPaymentDueDate": "2026-06-01T00:00:00",
    "PaymentDueMonth": "2026-07-01T00:00:00",
    "TotalPaymentAmount": 1250.25,
    "PendingEscrowPaymentAmount": 360,
    "InterestRate": 0.051,
    "MonthlyPaymentAmount": 890.25,
    "MonthlyPaymentPrincipalAmount": 311.59,
    "MonthlyPaymentInterestAmount": 578.66,
    "MonthlyCountyTaxAmount": 216,
    "MonthlyHazardInsuranceAmount": 144,
    "QuotedLateChargeFeeAmount": 35,
    "LateChargeGraceEndDate": "2026-07-01T00:00:00"
  },
  {
    "PaymentScheduleId": 1007212,
    "LoanId": 100721,
    "NextPaymentDueDate": "2026-06-01T00:00:00",
    "PaymentDueMonth": "2026-08-01T00:00:00",
    "TotalPaymentAmount": 1250.25,
    "PendingEscrowPaymentAmount": 360,
    "InterestRate": 0.051,
    "MonthlyPaymentAmount": 890.25,
    "MonthlyPaymentPrincipalAmount": 311.59,
    "MonthlyPaymentInterestAmount": 578.66,
    "MonthlyCountyTaxAmount": 216,
    "MonthlyHazardInsuranceAmount": 144,
    "QuotedLateChargeFeeAmount": 35,
    "LateChargeGraceEndDate": "2026-08-01T00:00:00"
  },
  {
    "PaymentScheduleId": 1007213,
    "LoanId": 100721,
    "NextPaymentDueDate": "2026-06-01T00:00:00",
    "PaymentDueMonth": "2026-09-01T00:00:00",
    "TotalPaymentAmount": 1250.25,
    "PendingEscrowPaymentAmount": 360,
    "InterestRate": 0.051,
    "MonthlyPaymentAmount": 890.25,
    "MonthlyPaymentPrincipalAmount": 311.59,
    "MonthlyPaymentInterestAmount": 578.66,
    "MonthlyCountyTaxAmount": 216,
    "MonthlyHazardInsuranceAmount": 144,
    "QuotedLateChargeFeeAmount": 35,
    "LateChargeGraceEndDate": "2026-09-01T00:00:00"
  },
  {
    "PaymentScheduleId": 1007214,
    "LoanId": 100721,
    "NextPaymentDueDate": "2026-06-01T00:00:00",
    "PaymentDueMonth": "2026-10-01T00:00:00",
    "TotalPaymentAmount": 1250.25,
    "PendingEscrowPaymentAmount": 360,
    "InterestRate": 0.051,
    "MonthlyPaymentAmount": 890.25,
    "MonthlyPaymentPrincipalAmount": 311.59,
    "MonthlyPaymentInterestAmount": 578.66,
    "MonthlyCountyTaxAmount": 216,
    "MonthlyHazardInsuranceAmount": 144,
    "QuotedLateChargeFeeAmount": 35,
    "LateChargeGraceEndDate": "2026-10-01T00:00:00"
  }
]
