[
  {
    "PaymentScheduleId": 1002450,
    "LoanId": 100245,
    "NextPaymentDueDate": "2026-06-01T00:00:00",
    "PaymentDueMonth": "2026-06-01T00:00:00",
    "TotalPaymentAmount": 2207.97,
    "PendingEscrowPaymentAmount": 615.3,
    "InterestRate": 0.04375,
    "MonthlyPaymentAmount": 1592.67,
    "MonthlyPaymentPrincipalAmount": 557.43,
    "MonthlyPaymentInterestAmount": 1035.24,
    "MonthlyCountyTaxAmount": 369.18,
    "MonthlyHazardInsuranceAmount": 246.12,
    "QuotedLateChargeFeeAmount": 35,
    "LateChargeGraceEndDate": "2026-06-01T00:00:00"
  },
  {
    "PaymentScheduleId": 1002451,
    "LoanId": 100245,
    "NextPaymentDueDate": "2026-06-01T00:00:00",
    "PaymentDueMonth": "2026-07-01T00:00:00",
    "TotalPaymentAmount": 2207.97,
    "PendingEscrowPaymentAmount": 615.3,
    "InterestRate": 0.04375,
    "MonthlyPaymentAmount": 1592.67,
    "MonthlyPaymentPrincipalAmount": 557.43,
    "MonthlyPaymentInterestAmount": 1035.24,
    "MonthlyCountyTaxAmount": 369.18,
    "MonthlyHazardInsuranceAmount": 246.12,
    "QuotedLateChargeFeeAmount": 35,
    "LateChargeGraceEndDate": "2026-07-01T00:00:00"
  },
  {
    "PaymentScheduleId": 1002452,
    "LoanId": 100245,
    "NextPaymentDueDate": "2026-06-01T00:00:00",
    "PaymentDueMonth": "2026-08-01T00:00:00",
    "TotalPaymentAmount": 2207.97,
    "PendingEscrowPaymentAmount": 615.3,
    "InterestRate": 0.04375,
    "MonthlyPaymentAmount": 1592.67,
    "MonthlyPaymentPrincipalAmount": 557.43,
    "MonthlyPaymentInterestAmount": 1035.24,
    "MonthlyCountyTaxAmount": 369.18,
    "MonthlyHazardInsuranceAmount": 246.12,
    "QuotedLateChargeFeeAmount": 35,
    "LateChargeGraceEndDate": "2026-08-01T00:00:00"
  },
  {
    "PaymentScheduleId": 1002453,
    "LoanId": 100245,
    "NextPaymentDueDate": "2026-06-01T00:00:00",
    "PaymentDueMonth": "2026-09-01T00:00:00",
    "TotalPaymentAmount": 2207.97,
    "PendingEscrowPaymentAmount": 615.3,
    "InterestRate": 0.04375,
    "MonthlyPaymentAmount": 1592.67,
    "MonthlyPaymentPrincipalAmount": 557.43,
    "MonthlyPaymentInterestAmount": 1035.24,
    "MonthlyCountyTaxAmount": 369.18,
    "MonthlyHazardInsuranceAmount": 246.12,
    "QuotedLateChargeFeeAmount": 35,
    "LateChargeGraceEndDate": "2026-09-01T00:00:00"
  },
  {
    "PaymentScheduleId": 1002454,
    "LoanId": 100245,
    "NextPaymentDueDate": "2026-06-01T00:00:00",
    "PaymentDueMonth": "2026-10-01T00:00:00",
    "TotalPaymentAmount": 2207.97,
    "PendingEscrowPaymentAmount": 615.3,
    "InterestRate": 0.04375,
    "MonthlyPaymentAmount": 1592.67,
    "MonthlyPaymentPrincipalAmount": 557.43,
    "MonthlyPaymentInterestAmount": 1035.24,
    "MonthlyCountyTaxAmount": 369.18,
    "MonthlyHazardInsuranceAmount": 246.12,
    "QuotedLateChargeFeeAmount": 35,
    "LateChargeGraceEndDate": "2026-10-01T00:00:00"
  },
  {
    "PaymentScheduleId": 1002455,
    "LoanId": 100245,
    "NextPaymentDueDate": "2026-06-01T00:00:00",
    "PaymentDueMonth": "2026-11-01T00:00:00",
    "TotalPaymentAmount": 2207.97,
    "PendingEscrowPaymentAmount": 615.3,
    "InterestRate": 0.04375,
    "MonthlyPaymentAmount": 1592.67,
    "MonthlyPaymentPrincipalAmount": 557.43,
    "MonthlyPaymentInterestAmount": 1035.24,
    "MonthlyCountyTaxAmount": 369.18,
    "MonthlyHazardInsuranceAmount": 246.12,
    "QuotedLateChargeFeeAmount": 35,
    "LateChargeGraceEndDate": "2026-11-01T00:00:00"
  }
]
